{
  "id": "human_reviewer",
  "status": "UNVERIFIED",
  "type": "human_or_domain_reviewer",
  "authority": "evidence_or_final_authority_when_designated",
  "requires_redaction": true,
  "requires_scope_statement": true,
  "default_axes": [
    "taste_or_business_fit",
    "risk_acceptance",
    "external_claim_readiness",
    "domain_specific_correctness"
  ],
  "output_ledger": "harness/reviewers/REVIEW_LEDGER.jsonl",
  "notes": "The project human remains final authority. Other human reviewers need explicit scope."
}
